{
  "schema_version": "1.0.0",
  "published_on": "2026-10-10",
  "boundary": {
    "en": "This registry transfers task-level evidence only when the task contract is comparable. Organization type changes context and controls, not the benchmark class. External evidence does not count as first-party field evidence for release 0.3.",
    "fr": "Ce registre ne transfère une mesure que lorsque le contrat de tâche est comparable. Le type d’organisation modifie le contexte et les contrôles, pas la catégorie de référence. Les sources externes ne constituent pas des preuves terrain produites par le guide pour la version 0.3."
  },
  "evidence_grades": {
    "A": {
      "en": "Controlled or paired measurements with actual task-time observations.",
      "fr": "Mesures contrôlées ou appariées avec observation réelle du temps de tâche."
    },
    "B": {
      "en": "Field telemetry or another objective operational measure.",
      "fr": "Télémétrie terrain ou autre mesure opérationnelle objective."
    },
    "C": {
      "en": "Self-reported time or survey estimate.",
      "fr": "Temps déclaré ou estimation issue d’une enquête."
    },
    "D": {
      "en": "Published case or capability test without an independently validated human-time comparison.",
      "fr": "Cas publié ou test de capacité sans comparaison du temps humain validée indépendamment."
    },
    "E": {
      "en": "Model-estimated, synthetic, or planning-only value.",
      "fr": "Valeur estimée par un modèle, synthétique ou réservée à la planification."
    }
  },
  "task_profiles": [
    {
      "profile_id": "professional_writing",
      "label": {
        "en": "Professional writing",
        "fr": "Rédaction professionnelle"
      },
      "description": {
        "en": "One bounded memo, analysis, email, or similar document with a defined reviewer.",
        "fr": "Une note, analyse, communication ou document similaire, borné et soumis à une revue définie."
      },
      "use_patterns": [
        "generation"
      ],
      "output_unit": {
        "en": "one reviewed document",
        "fr": "un document relu"
      },
      "quality_gates": [
        "draft",
        "reviewed"
      ]
    },
    {
      "profile_id": "knowledge_analysis",
      "label": {
        "en": "Knowledge analysis",
        "fr": "Analyse de connaissances"
      },
      "description": {
        "en": "A bounded bundle of research, analysis, synthesis, and recommendation tasks.",
        "fr": "Un ensemble borné de recherche, analyse, synthèse et recommandation."
      },
      "use_patterns": [
        "generation",
        "retrieval",
        "classification"
      ],
      "output_unit": {
        "en": "one reviewed analysis bundle",
        "fr": "un dossier d’analyse relu"
      },
      "quality_gates": [
        "reviewed"
      ]
    },
    {
      "profile_id": "software_greenfield",
      "label": {
        "en": "Bounded greenfield code",
        "fr": "Code neuf et borné"
      },
      "description": {
        "en": "A self-contained implementation task in a small or unfamiliar codebase with explicit acceptance tests.",
        "fr": "Une tâche d’implémentation autonome dans une base limitée ou inconnue, avec des tests d’acceptation explicites."
      },
      "use_patterns": [
        "generation",
        "agentic"
      ],
      "output_unit": {
        "en": "one accepted implementation",
        "fr": "une implémentation acceptée"
      },
      "quality_gates": [
        "reviewed",
        "production"
      ]
    },
    {
      "profile_id": "software_mature_repo",
      "label": {
        "en": "Mature known repository",
        "fr": "Dépôt mature et connu"
      },
      "description": {
        "en": "A real issue in a large repository that the experienced contributor already knows well.",
        "fr": "Un ticket réel dans un grand dépôt que le contributeur expérimenté connaît déjà bien."
      },
      "use_patterns": [
        "generation",
        "retrieval",
        "agentic"
      ],
      "output_unit": {
        "en": "one review-ready repository issue",
        "fr": "un ticket prêt pour la revue"
      },
      "quality_gates": [
        "production"
      ]
    },
    {
      "profile_id": "information_synthesis",
      "label": {
        "en": "Information search and synthesis",
        "fr": "Recherche et synthèse d’information"
      },
      "description": {
        "en": "Find, compare, and summarize existing information with source checking.",
        "fr": "Trouver, comparer et résumer des informations existantes avec vérification des sources."
      },
      "use_patterns": [
        "retrieval",
        "classification",
        "generation"
      ],
      "output_unit": {
        "en": "one verified answer or synthesis",
        "fr": "une réponse ou synthèse vérifiée"
      },
      "quality_gates": [
        "draft",
        "reviewed"
      ]
    },
    {
      "profile_id": "office_day_bundle",
      "label": {
        "en": "Daily office task bundle",
        "fr": "Ensemble de tâches bureautiques quotidiennes"
      },
      "description": {
        "en": "A mixed workday containing email, meeting, document, search, and reporting tasks.",
        "fr": "Une journée mixte comprenant courriels, réunions, documents, recherches et rapports."
      },
      "use_patterns": [
        "generation",
        "retrieval",
        "classification",
        "conversation"
      ],
      "output_unit": {
        "en": "one working day",
        "fr": "une journée de travail"
      },
      "quality_gates": [
        "draft",
        "reviewed"
      ]
    },
    {
      "profile_id": "customer_support",
      "label": {
        "en": "Customer support conversation",
        "fr": "Conversation de support client"
      },
      "description": {
        "en": "Resolve one customer issue under a defined quality and escalation policy.",
        "fr": "Résoudre une demande client selon une politique définie de qualité et d’escalade."
      },
      "use_patterns": [
        "conversation",
        "retrieval",
        "generation"
      ],
      "output_unit": {
        "en": "one resolved support issue",
        "fr": "une demande de support résolue"
      },
      "quality_gates": [
        "reviewed",
        "production"
      ]
    },
    {
      "profile_id": "hard_automation_project",
      "label": {
        "en": "Hard automation project",
        "fr": "Projet fortement automatisé"
      },
      "description": {
        "en": "A long-horizon project executed through several agents or tools under an explicit harness and human direction.",
        "fr": "Un projet long exécuté par plusieurs agents ou outils dans un environnement de contrôle explicite et sous direction humaine."
      },
      "use_patterns": [
        "agentic",
        "generation",
        "retrieval"
      ],
      "output_unit": {
        "en": "one accepted project increment",
        "fr": "un incrément de projet accepté"
      },
      "quality_gates": [
        "production"
      ]
    },
    {
      "profile_id": "predictive_decision_support",
      "label": {
        "en": "Predictive decision support",
        "fr": "Aide à la décision prédictive"
      },
      "description": {
        "en": "One forecast or score compared with a frozen historical baseline before a person decides.",
        "fr": "Une prévision ou un score comparé à une référence historique figée avant la décision humaine."
      },
      "use_patterns": [
        "prediction"
      ],
      "output_unit": {
        "en": "one reviewed forecast batch",
        "fr": "un lot de prévisions revu"
      },
      "quality_gates": [
        "reviewed"
      ]
    },
    {
      "profile_id": "multimodal_review",
      "label": {
        "en": "Multimodal review",
        "fr": "Revue multimodale"
      },
      "description": {
        "en": "Review one authorized media set and produce a checked description or discrepancy list.",
        "fr": "Examiner un lot de médias autorisés et produire une description relue ou une liste d’écarts."
      },
      "use_patterns": [
        "multimodal",
        "classification",
        "generation"
      ],
      "output_unit": {
        "en": "one reviewed media set",
        "fr": "un lot de médias revu"
      },
      "quality_gates": [
        "reviewed"
      ]
    },
    {
      "profile_id": "software_enterprise_patch",
      "label": {
        "en": "Tested change in an unfamiliar codebase",
        "fr": "Modification testée dans un code peu familier"
      },
      "description": {
        "en": "Tested change in an unfamiliar codebase: one bounded task with a defined review.",
        "fr": "Modification testée dans un code peu familier : une tâche bornée avec une revue définie."
      },
      "use_patterns": [
        "generation",
        "agentic"
      ],
      "output_unit": {
        "en": "one tested software change",
        "fr": "une modification logicielle testée"
      },
      "quality_gates": [
        "reviewed"
      ]
    },
    {
      "profile_id": "identity_policy_review",
      "label": {
        "en": "Review access policies",
        "fr": "Revue de règles d’accès"
      },
      "description": {
        "en": "Review access policies: one bounded task with a defined review.",
        "fr": "Revue de règles d’accès : une tâche bornée avec une revue définie."
      },
      "use_patterns": [
        "retrieval",
        "classification",
        "generation",
        "agentic"
      ],
      "output_unit": {
        "en": "one reviewed policy bundle",
        "fr": "un ensemble de règles relu"
      },
      "quality_gates": [
        "reviewed"
      ]
    }
  ],
  "records": [
    {
      "evidence_id": "TT-2023-NOY-ZHANG-WRITING",
      "title": {
        "en": "Professional writing experiment",
        "fr": "Expérience de rédaction professionnelle"
      },
      "reader_summary": {